{
  "schema_version": 2,
  "id": "conversation-example-01",
  "created_at": "2026-08-16T12:00:00+08:00",
  "source": {
    "type": "conversation",
    "reference": "fixture conversation turn 3",
    "quote": "[SIMULATED] Put the result first."
  },
  "classification": {
    "feedback_type": ["expression"],
    "target_layer": "L1",
    "target_section": "reporting",
    "scope": "contextual",
    "sensitivity": "normal"
  },
  "change": {
    "scene": "[SIMULATED] Delivering a small tool",
    "wrong": "[SIMULATED] Listing process before outcome",
    "correct": "[SIMULATED] Lead with result and verification",
    "proposed_action": "[SIMULATED] Keep as a pending candidate"
  },
  "evidence_ids": [],
  "conflicts": [],
  "status": "pending"
}
